[
  {
    "quantity": 1, 
    "environment_type": "StartupEcosystem", 
    "params": {
      "market_condition": {"type": "probabilistic", "distribution": "volatility_profile"}, 
      "risk_free_rate": {"type": "deterministic", "value": 0.05}, 
      "tick_duration_months": {"type": "deterministic", "value": 1}, 
      "regulatory_pressure": {"type": "probabilistic", "distribution": "market_sentiment"}, 
      "tax_rate": {"type": "deterministic", "value": 0.15}, 
      "compliance_cost_index": {"type": "deterministic", "value": 1.0}
    }, 
    "members": [
      {
        "agent_id": "Startup_1", 
        "agent_rol": {"is_private": {"type": "deterministic", "value": false}, "sector": {"type": "deterministic", "value": "tech"}}
      }, 
      {
        "agent_id": "RevenueStream_1", 
        "agent_rol": {"is_private": {"type": "deterministic", "value": false}}
      },
      {
        "agent_id": "ShockEvent_1",
        "agent_rol": {"is_private": {"type": "deterministic", "value": false}}
      },
      {
        "agent_id": "Regulator_1", "agent_rol": {"is_private": {"type": "deterministic", "value": false}, "jurisdiction": {"type": "deterministic", "value": "national"}}
      },
      {
        "agent_id": "Founder_1", "agent_rol": {"is_private": {"type": "deterministic", "value": true}, "equity_stake": {"type": "deterministic", "value": 0.6}}
      },
      {
        "agent_id": "TalentMarket_1", 
        "agent_rol": {"is_private": {"type": "deterministic", "value": true}}
      }
    ], 
    "relations": [
      {
        "members": ["Investor_1", "Startup_1"], 
        "metadata": {"is_approved": {"type": "deterministic", "value": true}, "commitment_level": {"type": "deterministic", "value": "full"}}
      },
      {
        "members": ["Investor_2", "Startup_1"],
        "metadata": {"is_approved": {"type": "deterministic", "value": true}, "commitment_level": {"type": "deterministic", "value": "partial"}}
      },
      {
        "members": ["Investor_3", "Startup_1"],
        "metadata": {"is_approved": {"type": "deterministic", "value": true}, "commitment_level": {"type": "deterministic", "value": "partial"}}
      },
      {
        "members": ["Investor_4", "Startup_1"],
        "metadata": {"is_approved": {"type": "deterministic", "value": true}, "commitment_level": {"type": "deterministic", "value": "exploratory"}}
      },
      {
        "members": ["Investor_5", "Startup_1"],
        "metadata": {"is_approved": {"type": "deterministic", "value": true}, "commitment_level": {"type": "deterministic", "value": "exploratory"}}
      },
      {
        "members": ["Startup_1", "RevenueStream_1"],
        "metadata": {"is_approved": {"type": "deterministic", "value": true}}
      },
      {
        "members": ["RevenueStream_1", "Startup_1"],
        "metadata": {"is_approved": {"type": "deterministic", "value": true}}
      },
      {
        "members": ["ShockEvent_1", "Startup_1"], 
        "metadata": {"is_approved": {"type": "deterministic", "value": true}}
      },
      {
        "members": ["Regulator_1", "Startup_1"],
        "metadata": {"is_approved": {"type": "deterministic", "value": true}, "audit_probability": {"type": "probabilistic", "distribution": "market_sentiment"}}
      },
      {
        "members": ["Founder_1", "Startup_1"], 
        "metadata": {"is_approved": {"type": "deterministic", "value": true}}
      },
      {
        "members": ["TalentMarket_1", "Founder_1"],
        "metadata": {"is_approved": {"type": "deterministic", "value": true}}
      }
    ],
    "channels": [
      {"channel_id": "startup_investor_1", "members": ["Startup_1", "Investor_1"], "events": []}, 
      {"channel_id": "startup_investor_2", "members": ["Startup_1", "Investor_2"], "events": []}, 
      {"channel_id": "startup_investor_3", "members": ["Startup_1", "Investor_3"], "events": []}, 
      {"channel_id": "startup_investor_4", "members": ["Startup_1", "Investor_4"], "events": []}, 
      {"channel_id": "startup_investor_5", "members": ["Startup_1", "Investor_5"], "events": []}, 
      {"channel_id": "startup_revenue", "members": ["Startup_1", "RevenueStream_1"], "events": []}, 
      {"channel_id": "regulator_startup", "members": ["Regulator_1", "Startup_1"], "events": [], "metadata": {"last_intervention_tick": {"type": "deterministic", "value": 0}}}, 
      {"channel_id": "founder_startup", "members": ["Founder_1", "Startup_1"], "events": []}, 
      {"channel_id": "founder_talent", "members": ["Founder_1", "TalentMarket_1"], "events": []}, 
      {"channel_id": "shock_regulator", "members": ["ShockEvent_1", "Regulator_1"], "events": []}
    ]
  }
]